{
 "schemaVersion": 3,
 "generatedBy": "npm run search:robustness",
 "contractMigration": {
  "schemaId": "topology-robustness.v3",
  "previousSchemaId": "topology-robustness.v2",
  "fromSchemaVersion": 2,
  "toSchemaVersion": 3,
  "breaking": true,
  "policy": {
   "document": "docs/SCHEMA_VERSIONING_POLICY.md",
   "policyVersion": 1,
   "decisionRule": "language-subset",
   "note": "判定は新旧 2 つの schema だけで行う。artifact の中身は見ない"
  },
  "consumerAction": "**schemaVersion で分岐すること。**2 を期待する実装は 3 を受け取ったら停止する。区間の終端が要るなら endExclusiveMm を、観測の最後の点が要るなら lastSampleMm を使う（v2 から変わっていない）。**artifact の配布名は変わらない**。",
  "renamedAssets": [
   {
    "from": "topology-robustness.v2.schema.json",
    "to": "topology-robustness.v3.schema.json",
    "reason": "schema ファイル名。artifact 側の名前は変わらない"
   }
  ],
  "history": [
   {
    "shippedIn": "v0.3.0",
    "previousRelease": "v0.2.0",
    "previousSchemaPath": "schemas/topology-robustness.v1.schema.json",
    "currentSchemaPath": "schemas/topology-robustness.v2.schema.json",
    "schemaVersionAtTheTime": 2,
    "versionWasHeld": false,
    "policyVerdict": "BUMP",
    "changes": [
     {
      "kind": "const-changed",
      "effect": "UNDECIDABLE",
      "schemaPointer": "/properties/schemaVersion/const",
      "instancePath": "$.schemaVersion",
      "from": 1,
      "to": 2,
      "reason": "版を上げた。**この回は条文どおりに上げている**"
     },
     {
      "kind": "field-renamed",
      "effect": "UNDECIDABLE",
      "schemaPointer": "/properties/nominalConfiguration/properties/windows/items",
      "instancePath": "$.nominalConfiguration.windows[]",
      "removed": [
       "fromMm",
       "toMm"
      ],
      "added": [
       "startMm",
       "lastSampleMm",
       "endExclusiveMm"
      ],
      "reason": "**「終わり」という語で 2 つの違う量を指していた。**旧 toMm は最後に当たった標本位置であって区間の終端ではない"
     },
     {
      "kind": "field-renamed",
      "effect": "UNDECIDABLE",
      "schemaPointer": "/properties/counterExamples/items/properties/windows/items",
      "instancePath": "$.counterExamples[].windows[]",
      "removed": [
       "fromMm",
       "toMm"
      ],
      "added": [
       "startMm",
       "lastSampleMm",
       "endExclusiveMm"
      ],
      "reason": "同上"
     },
     {
      "kind": "field-added",
      "effect": "WIDEN",
      "schemaPointer": "/properties/windowEndConvention",
      "instancePath": "$.windowEndConvention",
      "added": [
       "windowEndConvention"
      ],
      "reason": "端点の規約を機械可読にした"
     },
     {
      "kind": "field-added",
      "effect": "WIDEN",
      "schemaPointer": "/properties/contractMigration",
      "instancePath": "$.contractMigration",
      "added": [
       "contractMigration"
      ],
      "reason": "対応表そのもの"
     },
     {
      "kind": "constraint-tightened",
      "effect": "NARROW",
      "schemaPointer": "/required",
      "instancePath": "$",
      "added": [
       "contractMigration",
       "windowEndConvention"
      ],
      "reason": "新しい項目を必須にした"
     }
    ]
   },
   {
    "shippedIn": "v0.4.0",
    "previousRelease": "v0.3.0",
    "previousSchemaPath": "schemas/topology-robustness.v2.schema.json",
    "currentSchemaPath": "schemas/topology-robustness.v2.schema.json",
    "schemaVersionAtTheTime": 2,
    "schemaVersionShouldHaveBeen": 3,
    "versionWasHeld": true,
    "policyVerdict": "BUMP",
    "recordedRetroactivelyIn": "v0.5.0",
    "changes": [
     {
      "kind": "enum-value-added",
      "effect": "WIDEN",
      "schemaPointer": "/properties/provenance/properties/inputFiles/items/properties/role/enum",
      "instancePath": "$.provenance.inputFiles[].role",
      "added": [
       "input-scope"
      ],
      "reason": "入力の範囲定義 source-input-scope.v1.json が入力になった。**追加のみだが、旧 schema を pin した consumer はこの値を拒む**"
     }
    ]
   },
   {
    "shippedIn": "v0.5.0",
    "previousRelease": "v0.4.1",
    "previousSchemaPath": "schemas/topology-robustness.v2.schema.json",
    "currentSchemaPath": "schemas/topology-robustness.v3.schema.json",
    "schemaVersionAtTheTime": 3,
    "versionWasHeld": false,
    "policyVerdict": "BUMP",
    "changes": [
     {
      "kind": "const-changed",
      "effect": "UNDECIDABLE",
      "schemaPointer": "/properties/schemaVersion/const",
      "instancePath": "$.schemaVersion",
      "from": 2,
      "to": 3,
      "reason": "版を上げた。**下流はここで分岐して止まる**"
     },
     {
      "kind": "field-reshaped",
      "effect": "WIDEN",
      "schemaPointer": "/properties/contractMigration",
      "instancePath": "$.contractMigration",
      "reason": "単一遷移のオブジェクトから history 形式へ変えた"
     },
     {
      "kind": "enum-value-added",
      "effect": "WIDEN",
      "schemaPointer": "/properties/provenance/properties/inputFiles/items/properties/role/enum",
      "instancePath": "$.provenance.inputFiles[].role",
      "added": [
       "contract-migration"
      ],
      "reason": "版と契約変更の対応表の正本 contract-migration.v1.json が入力になった"
     }
    ]
   }
  ]
 },
 "windowEndConvention": "EXCLUSIVE",
 "variantId": "TRS|JACK-TRRS",
 "targetTopologyClass": "ground-open-differential",
 "basis": "MODEL_PARAMETER_SWEEP",
 "generatedFromCommit": "d0f3b219e522629ae30e4dbe667738165e63b861",
 "provenance": {
  "generatorVersion": 4,
  "generatedFromCommit": "d0f3b219e522629ae30e4dbe667738165e63b861",
  "workingTreeDirty": false,
  "revisionOverride": false,
  "artifactKind": "release",
  "inputDigestAlgorithm": "sha256",
  "inputDigest": "3a043430a5f34cf5e95037e6bdc2145384fdd3ba2d0666f39659f7a2c01a53eb",
  "inputDigestScope": "先頭に \"setting  <key>=<value>\" を key 昇順で 4 行置き、続けて inputFiles を path の昇順に並べ、\"<sha256>  <path>\" を改行で連結した文字列の sha256。setting 行は**ファイルに現れない variant 固有の設定**で、これが無いと variant 間で digest が同一になる。**生成される artifact 自身は含まない。**",
  "inputSettings": {
   "variantId": "TRS|JACK-TRRS",
   "targetTopologyClass": "ground-open-differential",
   "stepMm": "0.02",
   "axes": "beamOffset[0|0.65|1.3];trrs.jack.contact.tip.axialCenterDelta[-1|0|1|2];trrs.jack.contact.ring1.axialCenterDelta[-1|0|1];trrs.jack.contact.ring2.axialCenterDelta[-0.5|0|0.5];plug.ringBandShift[-0.3|0|0.2];trrs.jack.contact.narrowPadWidth[0.2|0.35|0.5|0.65];trrs.jack.contact.sleeve.axialCenter[1.25|3];model.conduction.minOverlap[0.01|0.02]"
  },
  "inputFiles": [
   {
    "path": "contract-migration.v1.json",
    "sha256": "f27ce53531e00880146b917e9df9cb0042b0ea63b0a096afcf2108604686b520",
    "role": "contract-migration"
   },
   {
    "path": "package-lock.json",
    "sha256": "64dc625a9cc34c83b4321d47147e12537455be06a09331ce4bfa968239dda72d",
    "role": "lockfile"
   },
   {
    "path": "schemas/topology-robustness.v3.schema.json",
    "sha256": "10ec667f043c2c65a017ae3ae2ed2765679a90026eb450d59fb02f4bc70bd1c3",
    "role": "schema"
   },
   {
    "path": "scripts/contractMigration.mjs",
    "sha256": "a8b62087dc36cad3aa21d24de9ac4b93c4a4fc5700f784146f6d89f977e9b21e",
    "role": "generator"
   },
   {
    "path": "scripts/measurementGate.mjs",
    "sha256": "1be8f4248f43bbe14f0f0e34bd68c0875d2cfc5d840a50ab93ec63a3d3cbcef5",
    "role": "generator"
   },
   {
    "path": "scripts/provenance.ts",
    "sha256": "ad943f639e4cd9531fc13f1bc549ad891a8f3247911f66c21bc712fca6062f00",
    "role": "generator"
   },
   {
    "path": "scripts/searchTopologyRobustness.ts",
    "sha256": "1b6fca6df32e443d50ce437fd3213d9d875098e920c11717dcc0b3e4ca07ade4",
    "role": "generator"
   },
   {
    "path": "source-input-scope.v1.json",
    "sha256": "ba7a855da4a06cd05f99a5387ab6537d741339d2b6c3aa86b06bd4454161dd43",
    "role": "input-scope"
   },
   {
    "path": "src/data/dimensions.json",
    "sha256": "318f0bb993030e0ebe936e21adb2ea4e952f5e0a7a18709e4227bc8a1e56dee7",
    "role": "model-data"
   },
   {
    "path": "src/data/faultPresets.json",
    "sha256": "ee586e1bf7e15b55398e148612b9ef6ad4b1f98a849d455d477b1c65a97f70ff",
    "role": "model-data"
   },
   {
    "path": "src/data/index.ts",
    "sha256": "1c2922b6698713f72c241b6f49809e3654ee909ddd94116cad6f90a57f124dd4",
    "role": "model-data"
   },
   {
    "path": "src/data/jackContacts.json",
    "sha256": "52e255dfbb3d0344b1aa922ac8092518395ed441c9ce69dcf7274434a19349db",
    "role": "model-data"
   },
   {
    "path": "src/data/jackContacts.trrs.json",
    "sha256": "f5443dcdda800abef9b928fde166f1930393f2e85c59b50851906d910e0d8e8f",
    "role": "model-data"
   },
   {
    "path": "src/data/materials.json",
    "sha256": "709bd006cc055bd44058c40f6ca8011c81e04ce3e795297e6edfeeebadb7889c",
    "role": "model-data"
   },
   {
    "path": "src/data/plugSegments.json",
    "sha256": "7d51e6f5a5a3961fca92039e217bf631a78e779a7fe1847078e3dd42a2347102",
    "role": "model-data"
   },
   {
    "path": "src/data/plugSegments.trrs.json",
    "sha256": "f5715e080d34a29fd93ab4f0a5e4bdc14d47cf77a5bc199c3b5ce8b7fb509ce2",
    "role": "model-data"
   },
   {
    "path": "src/data/sourceReferences.json",
    "sha256": "b21590bdb56f65343c99512fad0ecd72b2c9200ed234b12f8428843dfa8f40de",
    "role": "model-data"
   },
   {
    "path": "src/model/circuit.ts",
    "sha256": "bfc407f8921aaf230cc736c6a368f9490d59f0da9acca16dabfbc9ba49ca3025",
    "role": "model-code"
   },
   {
    "path": "src/model/contact.ts",
    "sha256": "e4a4e78b14fd2f7d1c0148a968617d4eb9c8395ed1f08b4e3eae355d31a4ae67",
    "role": "model-code"
   },
   {
    "path": "src/model/engine.ts",
    "sha256": "7ecd30ba22d3b587f8782c7469e1c9cfedcb6fc5b098436e0e75b902c0b938aa",
    "role": "model-code"
   },
   {
    "path": "src/model/force.ts",
    "sha256": "1f6bc966eba29a27091d7d55afc278a365396aa690302b0492d3a5734e9974c1",
    "role": "model-code"
   },
   {
    "path": "src/model/resolve.ts",
    "sha256": "73e197830e9c0b5f7e46ffedba781f3689fd8e21fbc73ad63cea955075d1a7cb",
    "role": "model-code"
   },
   {
    "path": "src/model/sweep.ts",
    "sha256": "bb88036fd8d757e652b66f36861b3b72a4abc6e9fd0f501761c785ff0a5472a4",
    "role": "model-code"
   },
   {
    "path": "src/model/topology.ts",
    "sha256": "12203873d4c89084734cd4cc2e6de4b139aaa3000bf8651f9bf8c1dd7db5cac9",